{
  "$schema": "http://json-schema.org/draft-07/schema#",
  "$id": "approval_request.schema.json",
  "title": "Human approval request (Chapter 9.5)",
  "description": "What a human reviewer sees before a workflow run is allowed to proceed: the proposed output itself, the uncertainties research left open, and independent reviewer findings — never a bare confirmation button with no content behind it.",
  "type": "object",
  "additionalProperties": false,
  "required": ["run_id", "company", "proposed_output", "uncertainties", "reviewer_findings"],
  "properties": {
    "run_id": { "type": "string", "minLength": 1 },
    "company": { "type": "string", "minLength": 1 },
    "proposed_output": {
      "description": "The (possibly partial) Account Brief awaiting a decision.",
      "type": "object"
    },
    "uncertainties": {
      "description": "Every unresolved_questions entry collected from subagent handoffs (Ch. 8.5), plus anything workflow_state.collect_errors() reports — never silently dropped before reaching the human.",
      "type": "array",
      "items": { "type": "string", "minLength": 1 }
    },
    "reviewer_findings": {
      "type": "array",
      "items": {
        "type": "object",
        "additionalProperties": false,
        "required": ["finding_id", "target_id", "verdict", "reason"],
        "properties": {
          "finding_id": { "type": "string", "pattern": "^RF-[0-9]{3,}$" },
          "target_id": { "type": "string", "minLength": 1 },
          "verdict": { "type": "string", "enum": ["approved", "rejected", "needs_revision"] },
          "reason": { "type": "string", "minLength": 1 }
        }
      }
    }
  }
}
