{
  "run_id": "RUN-001",
  "company": "Rockwell Automation",
  "proposed_output": {
    "schema_version": "1.1.0",
    "company_profile": {
      "company": "Rockwell Automation",
      "industry": "industrial automation",
      "size_estimate": "large, tens of thousands of employees globally",
      "business_model": "Sells industrial automation and information hardware, software, and services to manufacturers.",
      "evidence_ids": ["EV-001"]
    },
    "signals": [],
    "stakeholder_roles": [],
    "hypotheses": [],
    "evidence": [
      {
        "evidence_id": "EV-001",
        "source": "https://rockwellautomation.com",
        "source_type": "official_company_source",
        "source_date": "2026-06-01",
        "retrieval_date": "2026-07-18",
        "evidence_text": "Rockwell Automation is a global provider of industrial automation and digital transformation solutions.",
        "confidence": 0.9,
        "claim_type": "fact",
        "support_type": "direct"
      }
    ],
    "outreach_drafts": [],
    "reviewer_findings": [],
    "approval_status": {
      "status": "pending_approval",
      "decided_by": null,
      "decided_at": null
    }
  },
  "uncertainties": [
    "signals stage failed: search_company_news returned not_configured (no search provider wired up for this run)",
    "stakeholders, hypotheses, outreach, and review stages are not_implemented as of Chapter 9 — no fabricated content was produced for them"
  ],
  "reviewer_findings": []
}
